{
  "quiz_date": "2026-02-20",
  "cefr_level": "B1",
  "keypoint_fingerprint": "workplace_touch_base",
  "questions": [
    {
      "id": 1,
      "type": "multiple_choice",
      "question": "Your colleague asks to 'touch base' about a project. What do they mean?",
      "context": "You receive a Slack message: 'Hey, can we touch base on the Q4 report?'",
      "options": [
        "A. They want to have a formal presentation",
        "B. They want to have a brief check-in conversation",
        "C. They want to cancel the project",
        "D. They want you to write the entire report"
      ],
      "correct_answer": "B",
      "explanation": "'Touch base' means having a brief, informal check-in. It comes from baseball and implies a quick connection, not a formal meeting.",
      "xp_value": 10,
      "display": {
        "type_emoji": "ğŸ”¤",
        "type_name": "é€‰æ‹©é¢˜ | Multiple Choice",
        "question_formatted": "ğŸ’¬ Your colleague asks to **'touch base'**. What do they mean?",
        "context_formatted": "ğŸ“± Slack: \"Hey, can we **touch base** on the Q4 report?\"",
        "options_formatted": [
          "â¬œ A. They want a formal presentation",
          "â¬œ B. They want a brief check-in",
          "â¬œ C. They want to cancel the project",
          "â¬œ D. They want you to write the report"
        ],
        "hint": "ğŸ’¡ Think about what kind of conversation this implies",
        "correct_feedback": "âœ… Correct! **'Touch base'** = quick check-in âš¡",
        "wrong_feedback": "âŒ Not quite. **'Touch base'** means a brief, informal chat!",
        "key_phrase": "**touch base**",
        "xp_display": "ğŸ’ +10 XP"
      }
    },
    {
      "id": 2,
      "type": "chinglish_fix",
      "question": "Identify and fix the Chinglish expression in this email:",
      "context": "\"Hi Team, I want to communicate with you about the project. Let's discuss together tomorrow.\"",
      "correct_answer": "touch base / sync up / check in",
      "explanation": "'Communicate with you' and 'discuss together' are direct translations that sound formal and awkward. Americans would say 'touch base' or 'sync up' instead.",
      "xp_value": 15,
      "display": {
        "type_emoji": "ğŸ”§",
        "type_name": "Chinglish ä¿®æ­£ | Fix the Chinglish",
        "question_formatted": "ğŸ”§ Find and fix the Chinglish expressions:",
        "email_formatted": "ğŸ“§ Original email:\n\"Hi Team, I want to 'communicate with you' about the project. Let's 'discuss together' tomorrow.\"",
        "hint": "ğŸ’¡ Hint: How would an American say this naturally?",
        "correct_feedback": "âœ… Fixed! **\"Let's touch base\"** or **\"Let's sync up\"** sounds much better! ğŸ‰",
        "wrong_feedback": "âŒ 'Communicate with you' â†’ **'touch base'**\nâŒ 'Discuss together' â†’ **'sync up'**",
        "answer_formatted": "ğŸ“ Better: \"Hi Team, can we **touch base** about the project? Let's **sync up** tomorrow.\"",
        "key_phrase": "**touch base / sync up**",
        "xp_display": "ğŸ’ +15 XP"
      }
    },
    {
      "id": 3,
      "type": "fill_blank",
      "question": "Complete the sentence with the correct expression:",
      "context": "You want to suggest a quick meeting with your manager. You say: 'I wanted to ___ on the project timeline.'",
      "word_bank": ["touch base", "discuss together", "communicate"],
      "correct_answer": "touch base",
      "explanation": "'Touch base' is the natural American expression for suggesting a quick check-in. 'Discuss together' sounds awkward and redundant.",
      "xp_value": 12,
      "display": {
        "type_emoji": "âœï¸",
        "type_name": "å¡«ç©ºé¢˜ | Fill in the Blank",
        "question_formatted": "âœï¸ Complete the sentence:",
        "context_formatted": "ğŸ’¼ To your manager: \"I wanted to **___** on the project timeline.\"",
        "word_bank_formatted": "ğŸ“¦ Word Bank: [ **touch base** | 'discuss together' âŒ | 'communicate' âŒ ]",
        "hint": "ğŸ’¡ Which sounds natural for a quick check-in with your manager?",
        "correct_feedback": "âœ… Perfect! **'Touch base'** is the way to go! ğŸ¯",
        "wrong_feedback": "âŒ 'Discuss together' sounds awkward. Try **'touch base'**!",
        "key_phrase": "**touch base**",
        "xp_display": "ğŸ’ +12 XP"
      }
    }
  ],
  "total_xp": 37,
  "passing_score": 70,
  "display": {
    "header": "ğŸ“ ä»Šæ—¥æµ‹éªŒ | Daily Quiz",
    "date": "ğŸ“… 2026-02-20",
    "topic": "ğŸ·ï¸ Topic: **workplace_touch_base**",
    "instructions": "ğŸ¯ 3é“å°é¢˜ï¼Œç­”å¯¹2é“å°±è¿‡å…³ï¼3 questions, get 2 right to pass!",
    "progress_bar": "â¬œâ¬œâ¬œ 0/3 questions",
    "xp_summary": "ğŸ’ Total XP: 37 | ğŸ† Pass: 2/3 correct",
    "footer": "â”€â”€â”€â”€â”€â”€â”€â”€â”€â”€â”€â”€â”€â”€â”€â”€â”€â”€â”€\nğŸ’ª Good luck! åŠ æ²¹! ğŸš€"
  },
  "generated": true
}
